{
  "schema_version": 1,
  "baseline": {
    "laravel/framework": {
      "version": "v13.33.0",
      "commit": "91188a17ceaa3dbace6e8a5f7abd0d042e466359"
    },
    "laravel/symfony-on-cloud": {
      "commit": "50c945170b6cb5690370d15fd725c6f82495e9ba"
    }
  },
  "exception_list": [
    {
      "id": "cloud.live_managed",
      "allowed_statuses": [
        "skipped"
      ],
      "reason": "Laravel Cloud does not yet enable managed queues for Python applications (docs/audits/2026-09-27/platform-findings.md).",
      "approval": "README platform status: managed queues are not enabled for Python"
    },
    {
      "id": "cloud.dashboard_retry_live",
      "allowed_statuses": [
        "skipped"
      ],
      "reason": "Requires a live managed queue for Python; the local replay probe (retry.dashboard_replay) covers the contract.",
      "approval": "D3"
    }
  ],
  "features": [
    {
      "id": "config.backend_selection",
      "title": "Backend mode selection",
      "expected": "LARAVEL_CLOUD_QUEUES_BACKEND=managed|sqs|redis selects the mode; when unset, the presence of LARAVEL_CLOUD_MANAGED_QUEUES_CONFIG selects managed and its absence raises ConfigurationError. REDIS_URL and AWS_* never select a backend. Settings passed in code override the environment. LARAVEL_CLOUD_QUEUES_REDIS_URL falls back to REDIS_URL only in redis mode. LARAVEL_CLOUD_QUEUES_SQS_ENDPOINT is refused when LARAVEL_CLOUD_MANAGED_QUEUES_CONFIG is present. Region is required in managed and sqs modes; an unknown mode value is a configuration error.",
      "tier": "unit",
      "required": true,
      "laravel_source": [
        {
          "path": "src/Illuminate/Foundation/CloudBootstrapper.php",
          "lines": "217-241",
          "symbol": "CloudBootstrapper::configureManagedQueues"
        }
      ],
      "symfony_source": [],
      "deviation": null,
      "project_decision": "D6a",
      "probe": [
        "tests/unit/config/test_loader.py::test_backend_must_be_explicit",
        "tests/unit/config/test_loader.py::test_redis_precedence",
        "tests/unit/config/test_loader.py::test_sqs_settings_and_code_overrides"
      ]
    },
    {
      "id": "config.managed_parse",
      "title": "Managed configuration parsing",
      "expected": "LARAVEL_CLOUD_MANAGED_QUEUES_CONFIG is parsed as JSON. Malformed JSON, driver != \"cloud\", or a missing connection object is a ConfigurationError (never treated as unconfigured). queues may be a list or an object (keys); it is an inventory, not a dispatch allowlist. Sender default queue = connection.queue; worker assignment = top-level queue, else \"default\". region is required. after_commit and overflow are preserved; overflow.enabled true logs a startup warning naming the consequence. credential_cache {enabled, store, fallback_store} is honoured per field over CLOUD_QUEUE_CREDENTIAL_CACHE_ENABLED/_STORE/_FALLBACK_STORE and defaults to enabled with the file store in managed mode (sqs mode: env opt-in, ecs/instance only). Unknown fields are preserved. Credentials, receipt handles and payloads are never logged by default.",
      "tier": "unit",
      "required": true,
      "laravel_source": [
        {
          "path": "src/Illuminate/Foundation/CloudBootstrapper.php",
          "lines": "217-241",
          "symbol": "CloudBootstrapper::configureManagedQueues"
        },
        {
          "path": "src/Illuminate/Foundation/CloudBootstrapper.php",
          "lines": "264-280",
          "symbol": "CloudBootstrapper::bootManagedQueues"
        },
        {
          "path": "src/Illuminate/Foundation/Cloud/Queue.php",
          "lines": "577-582",
          "symbol": "Queue::managedQueues"
        },
        {
          "path": "src/Illuminate/Queue/Connectors/SqsConnector.php",
          "lines": "22-38",
          "symbol": "SqsConnector::connect"
        }
      ],
      "symfony_source": [
        {
          "path": "src/Queue/ManagedQueueConfig.php",
          "lines": "48-92",
          "symbol": "ManagedQueueConfig::fromEnvironment"
        }
      ],
      "deviation": {
        "label": "managed-config-strict-shape",
        "follows": "project",
        "summary": "Laravel throws only on malformed JSON (JSON_THROW_ON_ERROR); a non-\"cloud\" driver silently skips managed-queue boot and a missing connection is auto-created. Symfony treats malformed JSON as unconfigured. The project rejects all three shapes at startup.",
        "decision": null
      },
      "project_decision": "D13",
      "probe": [
        "tests/unit/config/test_loader.py::test_managed_strict_shape",
        "tests/unit/config/test_loader.py::test_managed_inventory_defaults_and_preservation",
        "tests/unit/config/test_loader.py::test_invalid_managed_field_types"
      ]
    },
    {
      "id": "config.credentials_explicit",
      "title": "Explicit credential providers",
      "expected": "In managed mode credentials: \"ecs\" selects botocore's container (ECS) credential provider explicitly with refreshable credentials; \"instance\" selects the instance-metadata provider; any other value, or an absent credentials key, is a ConfigurationError. boto3's default credential chain and AWS_ENDPOINT_URL* are never consulted in managed mode.",
      "tier": "unit",
      "required": true,
      "laravel_source": [
        {
          "path": "src/Illuminate/Queue/Connectors/SqsConnector.php",
          "lines": "61-113",
          "symbol": "SqsConnector::withCredentials, resolveCredentialProvider"
        }
      ],
      "symfony_source": [
        {
          "path": "src/Queue/Sqs/SqsClientFactory.php",
          "lines": "20-36",
          "symbol": "SqsClientFactory::create"
        }
      ],
      "deviation": {
        "label": "credentials-explicit-only",
        "follows": "project",
        "summary": "Laravel accepts ecs/instance strings, provider objects and callables; an absent credentials key falls through first to explicit key/secret (including token), then to the SDK default chain. Symfony uses the default chain for anything but ecs. The project accepts only ecs/instance strings in managed mode, rejecting missing or other values and never using the default chain because Cloud object storage occupies AWS_*.",
        "decision": "D13"
      },
      "project_decision": "D13",
      "probe": [
        "tests/unit/config/test_loader.py::test_managed_strict_shape",
        "tests/unit/config/test_loader.py::test_required_sqs_settings",
        "tests/unit/config/test_loader.py::test_default_credentials_are_opt_in",
        "tests/unit/sqs/test_client.py::test_selected_provider_is_refreshable_and_exclusive",
        "tests/unit/sqs/test_client.py::test_no_provider_credentials_never_falls_back",
        "tests/unit/sqs/test_client.py::test_default_chain_requires_explicit_opt_in_and_ignores_endpoint"
      ]
    },
    {
      "id": "config.agent_socket_resolution",
      "title": "Agent socket path resolution",
      "expected": "The agent socket is agent.socket from the managed config when it is a non-empty string, else LARAVEL_CLOUD_AGENT_SOCKET, else /tmp/cloud-agent.sock. The environment variable never overrides an explicit config value. Agent use is decided by agent.enabled, never by probing the socket path.",
      "tier": "unit",
      "required": true,
      "laravel_source": [
        {
          "path": "src/Illuminate/Foundation/Cloud/Queue.php",
          "lines": "365-374",
          "symbol": "Queue::agentRequest"
        },
        {
          "path": "src/Illuminate/Foundation/Cloud/Queue.php",
          "lines": "392-408",
          "symbol": "Queue::usesAgent, Queue::workerQueue"
        }
      ],
      "symfony_source": [
        {
          "path": "src/Queue/ManagedQueueConfig.php",
          "lines": "48-92",
          "symbol": "ManagedQueueConfig::fromEnvironment"
        },
        {
          "path": "src/LaravelCloudBundle.php",
          "lines": "101-104",
          "symbol": "LaravelCloudBundle::registerPlatform (agent_socket)"
        },
        {
          "path": "src/Queue/ManagedQueueConfig.php",
          "lines": "196-199",
          "symbol": "ManagedQueueConfig::agentAvailable"
        }
      ],
      "deviation": {
        "label": "agent-socket-env-fallback",
        "follows": "symfony",
        "summary": "Laravel reads only agent.socket with the /tmp/cloud-agent.sock default; Symfony adds the LARAVEL_CLOUD_AGENT_SOCKET fallback between them.",
        "decision": null
      },
      "project_decision": null,
      "probe": [
        "tests/unit/config/test_loader.py::test_code_and_socket_precedence"
      ]
    },
    {
      "id": "config.sqs_isolated_aws",
      "title": "Self-managed sqs mode ignores AWS_* variables",
      "expected": "In sqs mode the boto3 client is built only from LARAVEL_CLOUD_QUEUES_SQS_* values (prefix, suffix, queue, region, key/secret or CREDENTIALS=default, endpoint). AWS_ACCESS_KEY_ID, AWS_SECRET_ACCESS_KEY, AWS_REGION, AWS_ENDPOINT_URL and AWS_ENDPOINT_URL_SQS set in the environment are not used; the client's endpoint is the configured one (or AWS's) even when AWS_ENDPOINT_URL points elsewhere. Missing key/secret without CREDENTIALS=default is a ConfigurationError.",
      "tier": "emulated",
      "required": true,
      "laravel_source": [],
      "symfony_source": [],
      "deviation": null,
      "project_decision": "D6a",
      "probe": [
        "tests/conformance/probes/test_brokers.py::test_sqs_processes"
      ]
    },
    {
      "id": "queue.url_and_normalization",
      "title": "Queue URL construction and normalization",